id,question                                                  ,firstAnswer      ,secondAnswer     ,ThirdAnswer         ,rightAnswer
1 ,Какой расы нет в игре World Of Warcraft?                  ,1 Орк            ,2 Ночной Эльф    ,3 Мутант            ,3 Мутант
2 ,Какого языка программирования не существует?              ,1 С++            ,2 Java           ,3 Viper++           ,2 Java
3 ,Какой планеты не существует?                              ,1 Птун           ,2 Нептун         ,3 Земля             ,1 Птун
4 ,В каком году родился Эйнштейн?                            ,1 1870           ,2 1873           ,3 1879              ,3 1879
5 ,В каком году гагарин полетел в космос?                    ,1 1960           ,2 1961           ,3 1962              ,3 1962